videoId,videoUrl,username,profileUrl,viewsCount,viewsDisplay,likesCount,likesDisplay,commentsCount,sharesCount,favoritesCount,caption,description,hashtags,mentions,musicTitle,musicAuthor,postedTime
7510980533841644831,https://www.tiktok.com/@mombie0405/video/7510980533841644831,mombie0405,https://www.tiktok.com/@mombie0405,2652,2.7K,13,13,,,,,Replying to @doingmybest inground cordless pool vacuum #poolcleaner #poolvacuum #robotpoolvacuum #viperpool #ingroundpool #ingroundpools #refinedliving #poolcleaning #summertime #pooltime #poolcleaner #roboticvacuum #roboticpoolcleaner #creatorsearchinsights #TikTokShopRestock#TikTokShopSpringGlowUp #tiktokshopmemorialday #tiktokrisingstar #springtok #Dealsforyoudays #tiktokshopsummerturnup @RefinedLiving ,poolcleaner;poolvacuum;robotpoolvacuum;viperpool;ingroundpool;ingroundpools;refinedliving;poolcleaning;summertime;pooltime;poolcleaner;roboticvacuum;roboticpoolcleaner;creatorsearchinsights;tiktokshoprestock;tiktokshopspringglowup;tiktokshopmemorialday;tiktokrisingstar;springtok;dealsforyoudays;tiktokshopsummerturnup,doingmybestbest;refinedliving01,original sound,Mombie 🧟,2025-06-01T14:01:04.000Z
7531061292296080662,https://www.tiktok.com/@thehomebadger/video/7531061292296080662,thehomebadger,https://www.tiktok.com/@thehomebadger,10500000,10.5M,161800,161.8K,,,,,Crazy it can outlive humans… 😱 Like if armageddon happened this thing would still be working 🤯 #WYBOT #Poolcleaner #robot,wybot;poolcleaner;robot,,original sound,thehomebadger,2025-07-25T16:44:12.000Z
7511835685024746794,https://www.tiktok.com/@selchankavamerike/video/7511835685024746794,selchankavamerike,https://www.tiktok.com/@selchankavamerike,28400,28.4K,241,241,,,,,Robotic Pool Vacuum Cleaner  #poolvacuum #poolside #poolcleaning #pool #clean #tiktokshop #tiktokdeals #sale #2025 ,poolvacuum;poolside;poolcleaning;pool;clean;tiktokshop;tiktokdeals;sale;2025,,No Sólo De Traficante,Los Tucanes De Tijuana,2025-06-03T21:19:31.000Z
7609341956065398046,https://www.tiktok.com/@walkerdailyfinds/video/7609341956065398046,walkerdailyfinds,https://www.tiktok.com/@walkerdailyfinds,340,340,9,9,,,,,"A cordless robotic pool cleaner designed to automatically vacuum dirt and debris during routine pool maintenance. Most people place it in the water, let it run a cleaning cycle, then remove it and rinse the filter afterward. The triple-motor system and brushes move across the floor, walls, and waterline to reduce manual brushing time. Rechargeable and hose-free, it fits easily into a weekly backyard routine for keeping the pool tidy.   robotic pool cleaner, cordless pool vacuum, automatic pool cleaner robot, wall climbing pool cleaner, pool floor vacuum robot, rechargeable pool cleaner, pool maintenance robot, backyard pool cleaning device, smart pool vacuum, pool cleaning equipment ##poolcare##poolmaintenance##poolcleaning##backyardliving##pooltools",poolcare;poolmaintenance;poolcleaning;backyardliving;pooltools,,original sound,walkerfamilystore,2026-02-21T15:33:35.000Z
7524606711215246597,https://www.tiktok.com/@mik.zenon/video/7524606711215246597,mik.zenon,https://www.tiktok.com/@mik.zenon,2800000,2.8M,20900,20.9K,,,,,On Sale for Prime Day 👀 You can find this under ✨Prime Day Deals✨ on my website. #amazon #vacuum ,amazon;vacuum,,original sound,Mik Zenon,2025-07-08T07:17:14.000Z
7513648570520685866,https://www.tiktok.com/@rachelsreno/video/7513648570520685866,rachelsreno,https://www.tiktok.com/@rachelsreno,173300,173.3K,581,581,,,,,These robot vacuums save so much time! Scuba SE compared to the scuba s1 #poolvacuum #poolcleaning #poolparty #abovegroundpoolsetup #abovegroundpool #robotpoolvacuum #cleanpool ,poolvacuum;poolcleaning;poolparty;abovegroundpoolsetup;abovegroundpool;robotpoolvacuum;cleanpool,,take on the world,audios 🎧,2025-06-08T18:34:40.000Z
7575838108113980693,https://www.tiktok.com/@anniesbucketlist/video/7575838108113980693,anniesbucketlist,https://www.tiktok.com/@anniesbucketlist,51400,51.4K,685,685,,,,,"@Aiper Black Friday and Cyber Monday deals are now on so you can save up to 40% off (link in bio). Enjoy an extra 5% off with the code: eleventh5off! This is the Aiper Scuba X1 Pro Max the cordless all-in-one pool cleaning robot that does absolutely everything from pools floors to walls, surface skimming to ledges. You can just turn it on, let it rub, get on with your day and come back to a sparkly clean pool!  [A D] #Aiper #AiperScubaX1ProMax #AiperScubaX1 #aipersurfers2 #BlackFriday2025 BlackFriday AiperBlackFriday PoolCleaning AiperRoboticPoolCleaner aiperpoolvacuumrobot",aiper;aiperscubax1promax;aiperscubax1;aipersurfers2;blackfriday2025,aiper_official,Warm Sunlight,Marscott,2025-11-23T08:41:11.000Z
7388212445849914656,https://www.tiktok.com/@thejunglebadger/video/7388212445849914656,thejunglebadger,https://www.tiktok.com/@thejunglebadger,442100,442.1K,13500,13.5K,,,,,This is one robot I don't mind taking over... 🔥  #Beatbot #AquaSense #roboticpoolcleaner,beatbot;aquasense;roboticpoolcleaner,,original sound,Best Online Finds,2024-07-05T17:57:48.000Z
7378503688907705643,https://www.tiktok.com/@chris_reviews_it/video/7378503688907705643,chris_reviews_it,https://www.tiktok.com/@chris_reviews_it,5810,5.8K,79,79,,,,,@Aiper Smart #Pool #PoolCleaning #Skimmer #SolarPower #Solar #SolarPoweredPoolCleaner #PoolRobot ,pool;poolcleaning;skimmer;solarpower;solar;solarpoweredpoolcleaner;poolrobot,aiper_official,Vlog ・ Stylish city pop(1275391),orino,2024-06-09T14:02:50.000Z
7487660583626624299,https://www.tiktok.com/@alainyander/video/7487660583626624299,alainyander,https://www.tiktok.com/@alainyander,1500000,1.5M,4742,4.7K,,,,,"WYBOT S2 Solar High-end Cordless Robotic Pool Cleaner • Diseño compacto con motor sin escobillas Carga del panel solar - Carga en la piscina, inicio y retorno con un solo toque * ﻿﻿Regresa automáticamente a la base de carga inductiva de la línea de flotación cuando la batería está baja * ﻿﻿Control remoto submarino * ﻿﻿Modo de limpieza del área puntual * ﻿﻿Horario de limpieza semanal * ﻿﻿Batería intercambiable * ﻿﻿Navegación inteligente basada en infrarrojos para una alta cobertura * ﻿﻿7 tipos de modo de limpieza incluido el modo turbo * ﻿﻿Filtración de 2 niveles * ﻿﻿Indicación del nivel de la batería * ﻿﻿Conexión de la aplicación y OTA disponibles #poolcleaning #poolcleaner #summertime #poolequipment #poolday #cleaner #poolmaintenance #swimmingpool #piscina #alberca ",poolcleaning;poolcleaner;summertime;poolequipment;poolday;cleaner;poolmaintenance;swimmingpool;piscina;alberca,,Epic,Metrow Ar,2025-03-30T17:47:55.000Z
7521197731843411255,https://www.tiktok.com/@hannah_a2018/video/7521197731843411255,hannah_a2018,https://www.tiktok.com/@hannah_a2018,2966,3.0K,39,39,,,,,"This robot pool vacuum just became my summer MVP 🏖️💦 Drops in, does all the work, and my pool has never looked better. Linked in bio! #amazonfind #poolcleaner #momlifemadeeasy #pooltok #robotvacuum #summertips #backyardgoals #amazonmusthaves #poolcleaning ",amazonfind;poolcleaner;momlifemadeeasy;pooltok;robotvacuum;summertips;backyardgoals;amazonmusthaves;poolcleaning,,Island In The Sun,Weezer,2025-06-29T02:48:50.000Z
7363004348084784426,https://www.tiktok.com/@itsjustmekimberly/video/7363004348084784426,itsjustmekimberly,https://www.tiktok.com/@itsjustmekimberly,164700,164.7K,1029,1.0K,,,,,#ofuzziwinnycyber1000 #roboticpoolcleaner #poolcleaner #@fiilpow_official #fiilpow #ingroundpool #abovegroundpool #pools #poolcleaners #poolequipment #mothersdaygift #fathersdaygift #tiktokshopsales ,ofuzziwinnycyber1000;roboticpoolcleaner;poolcleaner;fiilpow;ingroundpool;abovegroundpool;pools;poolcleaners;poolequipment;mothersdaygift;fathersdaygift;tiktokshopsales,fiilpow_official,original sound,Kimberly morton,2024-04-28T19:37:46.000Z
7597995236555590967,https://www.tiktok.com/@jrettinger/video/7597995236555590967,jrettinger,https://www.tiktok.com/@jrettinger,5008,5.0K,813,813,,,,,"Checking out the Beatbot booth at CES 2026! This is the new AquaSense X: it’s a literal cleaning and charging station for your pool robot. It docks, it cleans itself, and you actually get your free time back. Game changer. 🏊‍♂️🤖 Check out my latest video to learn more about Beatbot - Link In Bio!  Beatbot AquaSense X launches Jan 5, 2026. Reserve with a $250 deposit to unlock 4-year warranty with full unit replacement (first 500 orders only). Preorder now: https://beatbot.com/pages/aquasense-x?utm_source=KOL&utm_medium=CPM&utm_campaign=2026-s1-max-ces-jan&utm_term=Tech+show&utm_content=JonRettinger Beatbot Sora 70 is now open for sign-up on Beatbot.  Visit https://beatbot.com/pages/sora-70?utm_source=KOL&utm_medium=CPM&utm_campaign=2026-m1-pro-ces-jan&utm_term=Tech+show&utm_content=JonRettinger to stay updated and be the first to know. #Beatbot #BeatbotCES2026 #BeatbotPerfectPools #Sora70 #Aquasensex @Beatbot ",beatbot;beatbotces2026;beatbotperfectpools;sora70;aquasensex,beatbotglobal,original sound,Jon Rettinger,2026-01-22T01:42:31.000Z
7530999812745907511,https://www.tiktok.com/@ginlustigvip/video/7530999812745907511,ginlustigvip,https://www.tiktok.com/@ginlustigvip,35700,35.7K,1287,1.3K,,,,,"Hydro 4SE Robotic Pool vacuum Cleaner filter,suction Wall/Waterline cleaning smart navigation floor pool cleaning/tool system 473inch/12m cable 4.1L Large Capacity  It effectively cleans walls and waterlines, tackling sand, twigs, leaves, and pet hair with ease  #Poolmate Hydro 4SE #PoolCleaner #Poolmate #RoboticVacuum #CleanPool #SmartNavigation #CordlessConvenience #IngroundPools #PoolMaintenance #EffortlessCleaning #SummerReady#pool vacuum#pool Cleaning #ginlustig ",poolmate;poolcleaner;poolmate;roboticvacuum;cleanpool;smartnavigation;cordlessconvenience;ingroundpools;poolmaintenance;effortlesscleaning;summerready;pool;pool;ginlustig,,original sound,Gin Lustig,2025-07-25T12:45:51.000Z
7387508151609724206,https://www.tiktok.com/@thebenderfam24/video/7387508151609724206,thebenderfam24,https://www.tiktok.com/@thebenderfam24,370900,370.9K,1712,1.7K,,,,,"The best pool cleaning hack, this robotic pool cleaner #pool #backyardpool #backyardvibes #cleaninghacks ",pool;backyardpool;backyardvibes;cleaninghacks,,original sound,The Bender Fam,2024-07-03T20:24:45.000Z
7506220243459558686,https://www.tiktok.com/@chandlerisaac/video/7506220243459558686,chandlerisaac,https://www.tiktok.com/@chandlerisaac,844100,844.1K,2954,3.0K,,,,,"Pool upgrade I didn't know I needed: cleaning the spa is no longer on my chore list thanks to our new little baby and world's first automatic spa cleaner the Polaris Spabot. She’s small, she's powerful, and she works harder than your pool man ever will ;) Polaris has been around for over 50 years and they know what they are doing when it comes to cleaning your pool and spa and this is the first automatic spa cleaner. It’s wildly easy to use, does not need an app, remote or programming just pop it in your hot tub and that's it! Head to your local pool store during Polaris Days for expert advice and exclusive deals you won’t find online. Because when it comes to trust, legacy, and quality—there’s only one Polaris. #polarispools #polarispoolcleaners #ad #poolbuild #poolcleaning #poolrobot #cleanwithme #cleaninghacks #poolgadgets #poolcleaner #poolaccessories #backyardrenovation #buildingapool #pooltips #poolmaintance #hottub #hottubcleaner #polarisdays ",polarispools;polarispoolcleaners;ad;poolbuild;poolcleaning;poolrobot;cleanwithme;cleaninghacks;poolgadgets;poolcleaner;poolaccessories;backyardrenovation;buildingapool;pooltips;poolmaintance;hottub;hottubcleaner;polarisdays,,original sound,CHANDLER ISAAC,2025-05-19T18:08:39.000Z
7607225723719355679,https://www.tiktok.com/@ls3dp/video/7607225723719355679,ls3dp,https://www.tiktok.com/@ls3dp,717,717,8,8,,,,,@igarden_official #poolrobot #poolcleaning #tiktokshopcreatorpicks ,poolrobot;poolcleaning;tiktokshopcreatorpicks,igarden_official,original sound,TheLightSpeed!,2026-02-15T22:41:23.000Z
7518437872051981581,https://www.tiktok.com/@marandaleann/video/7518437872051981581,marandaleann,https://www.tiktok.com/@marandaleann,437700,437.7K,1045,1.0K,,,,,This is the best pool vacuum I've found and has saved me so much time cleaning my pool!  #AIPER #aiperpoolvacuum #automaticpoolvacuum  #poolvacuum #vacuum #abovegroundpool #poolhack #tiktokshopcreatorpicks #dealsforyoudays #poolmusthave #summer ,aiper;aiperpoolvacuum;automaticpoolvacuum;poolvacuum;vacuum;abovegroundpool;poolhack;tiktokshopcreatorpicks;dealsforyoudays;poolmusthave;summer,,original sound,Maranda Leann,2025-06-21T16:19:29.000Z
7523611597210684727,https://www.tiktok.com/@1ahmi/video/7523611597210684727,1ahmi,https://www.tiktok.com/@1ahmi,603,603,35,35,,,,,#fypシ゚ #summervibes #trending #pool ,fypシ゚;summervibes;trending;pool,,original sound,kardashianshulu,2025-07-05T14:56:28.000Z
7493680374564965678,https://www.tiktok.com/@unfiltered.reviews/video/7493680374564965678,unfiltered.reviews,https://www.tiktok.com/@unfiltered.reviews,115500,115.5K,185,185,,,,,this is by far one of the best pool vacuums I've ever had. #poolvacuum #poolcleaner #poolmaintenance #poolvac #robotpoolvacuum #pool #poolcleaning ,poolvacuum;poolcleaner;poolmaintenance;poolvac;robotpoolvacuum;pool;poolcleaning,,original sound,unfiltered,2025-04-15T23:07:33.000Z
7335488320895520042,https://www.tiktok.com/@swimuniversity/video/7335488320895520042,swimuniversity,https://www.tiktok.com/@swimuniversity,26500,26.5K,155,155,,,,,Robotic Pool Cleaners: Worth It?,,,original sound,Swim University®,2024-02-14T16:01:39.000Z
7510261919450696991,https://www.tiktok.com/@getawaysbygabby/video/7510261919450696991,getawaysbygabby,https://www.tiktok.com/@getawaysbygabby,24400,24.4K,151,151,,,,,"Say goodbye to manual pool cleaning with the Aiper Surfer Robotic Skimmer! & This cordless, solar-powered skimmer glides effortlessly across your pool, collecting leaves, debris, and dust - so you can enjoy crystal-clear water with zero effort. Smart sensors and long battery life make it the ultimate pool maintenance upgrade. Work smarter, not harder this summer! #AiperSurfer #RoboticSkimmer #PoolLife #SmartPool #PoolCleaning #SummerReady #BackyardGoals #SolarPowered #TechForHome #PoolCare #LazySummerDays #EcoFriendlyTech #CordlessSkimmer #PoolMaintenance #smarthomegadgets #tiktokshopcreatorpicks ##tiktokshopsummerturnup #creatoricons #ttsthunderbolt ",aipersurfer;roboticskimmer;poollife;smartpool;poolcleaning;summerready;backyardgoals;solarpowered;techforhome;poolcare;lazysummerdays;ecofriendlytech;cordlessskimmer;poolmaintenance;smarthomegadgets;tiktokshopcreatorpicks;tiktokshopsummerturnup;creatoricons;ttsthunderbolt,,original sound,Getaway Gabby,2025-05-30T15:32:19.000Z
7519268109774114079,https://www.tiktok.com/@lauraleiser_/video/7519268109774114079,lauraleiser_,https://www.tiktok.com/@lauraleiser_,257900,257.9K,3012,3.0K,,,,,Robot inalámbrico para todo tipo de piscina excelente calidad con una duración máxima de su batería !   @@WYBOT US ##WYBOT##WYBOTC1##limpiadordepiscinas##robots##robotdepiscina##limpiadordepiscinas##aspiradordepiscinas,wybot;wybotc1;limpiadordepiscinas;robots;robotdepiscina;limpiadordepiscinas;aspiradordepiscinas,wybot.official,sonido original,Laura Leiser,2025-06-23T22:00:58.000Z
7415362132885327150,https://www.tiktok.com/@michaelemuhammad/video/7415362132885327150,michaelemuhammad,https://www.tiktok.com/@michaelemuhammad,65,65,0,0,,,,,,,,Don't Worry Be Happy,Reggae Allstars,2024-09-16T21:52:37.000Z
7249447630856752430,https://www.tiktok.com/@gracefulmommy/video/7249447630856752430,gracefulmommy,https://www.tiktok.com/@gracefulmommy,91500,91.5K,587,587,,,,,Amazon find ☀️ this cordless pool vacuum is a game-changer for keeping the pool clean without any annoying cord in the way 👏🏼👏🏼 linked in my amazon storefront under “tiktok finds” #amazonfinds #amazonprime #primeday #amazonprimeday #amazon #poolcleaner #poolproduct #poolvacuum #summer ,amazonfinds;amazonprime;primeday;amazonprimeday;amazon;poolcleaner;poolproduct;poolvacuum;summer,,Caramel Latte,Prod. By Rose,2023-06-27T19:19:35.000Z
7490569551202045226,https://www.tiktok.com/@dailyscriptok/video/7490569551202045226,dailyscriptok,https://www.tiktok.com/@dailyscriptok,22900,22.9K,147,147,,,,,"Replying to @rgkdetailing . Dive into pool cleaning with the Solar-Powered Pool Vacuum! Say goodbye to cords and sky-high energy bills. This eco-friendly cleaner harnesses the sun's power to keep your pool sparkling, giving you more time to relax and enjoy your summer. #TikTokShop #SummerEssentials #PoolCleaning #CleanTok #SolarPoolVacuum #EcoFriendlyPool #CordlessPoolCleaner #PoolHacks #TheTickTockShop #SmartHome   ",tiktokshop;summeressentials;poolcleaning;cleantok;solarpoolvacuum;ecofriendlypool;cordlesspoolcleaner;poolhacks;theticktockshop;smarthome,rgkdetails,original sound,Daily Scriptok,2025-04-07T13:56:47.000Z
7377928137310489898,https://www.tiktok.com/@everydayali__/video/7377928137310489898,everydayali__,https://www.tiktok.com/@everydayali__,593700,593.7K,4705,4.7K,,,,,CHECK YOUR COUPONS! ‼️Proof that TikTok shop has better deals! #roboticpoolcleaner #poolcleanup #poolcleaning #pool #abovegroundpool #undergroundpool #abovegroundpoolsetup #cordlesspoolcleaner #foryoupage #foryou #fypシ゚viral #tiktokshopfinds ,roboticpoolcleaner;poolcleanup;poolcleaning;pool;abovegroundpool;undergroundpool;abovegroundpoolsetup;cordlesspoolcleaner;foryoupage;foryou;fypシ゚viral;tiktokshopfinds,,original sound,Ali 🗝️,2024-06-08T00:49:22.000Z
7397968063242554654,https://www.tiktok.com/@rachelsreno/video/7397968063242554654,rachelsreno,https://www.tiktok.com/@rachelsreno,148500,148.5K,697,697,,,,,A MUST HAVE if you own a pool! Seriously my highest recommendation!! Love this soo much! #robotvacuumcleaner #poolvacuum #cleanpool#pool#summervibes#poolcleaning #poolvacuuming #automatic#robotic#easy#poolhack#aiper ,robotvacuumcleaner;poolvacuum;cleanpool;pool;summervibes;poolcleaning;poolvacuuming;automatic;robotic;easy;poolhack;aiper,,Spring Forest Birds Sing Near the Road,Aadam Aki,2024-08-01T00:54:42.000Z
7552641373430730014,https://www.tiktok.com/@webb_tech/video/7552641373430730014,webb_tech,https://www.tiktok.com/@webb_tech,38200,38.2K,40,40,,,,,Fanttik Robotic Pool Cleaner #fanttik #tiktokshoprestock #poolcleaning #spotlightfinds #webbtech ,fanttik;tiktokshoprestock;poolcleaning;spotlightfinds;webbtech,,original sound,Webb Tech,2025-09-21T20:26:11.000Z
7232676652084481322,https://www.tiktok.com/@phillynut4life/video/7232676652084481322,phillynut4life,https://www.tiktok.com/@phillynut4life,6766,6.8K,44,44,,,,,#Polarisfreedompoolcleaner  #Polaris #robotvacuumcleaner  #cordlesspoolcleaner  #pinchapenny  #pinchapennyhudson ,polarisfreedompoolcleaner;polaris;robotvacuumcleaner;cordlesspoolcleaner;pinchapenny;pinchapennyhudson,,Tropical Paradise(824514),TimTaj,2023-05-13T14:39:40.000Z
7508869372031683870,https://www.tiktok.com/@genx03333/video/7508869372031683870,genx03333,https://www.tiktok.com/@genx03333,3192,3.2K,18,18,,,,,"(2025 Upgrade) WYBOT C1 Robotic Pool Vacuum for Inground Pools, 150min Runtime Cordless Pool Cleaner, 4-in-1 Wall & Waterline Cleaning Up to 1,614Sq.ft, Smart Navigation, App Support. @Wybot ",,wybot.us,Cool Pool Party Summer Fun,DMmusic,2025-05-26T21:28:37.000Z
6981962818153188614,https://www.tiktok.com/@paigejed21/video/6981962818153188614,paigejed21,https://www.tiktok.com/@paigejed21,25100,25.1K,132,132,,,,,Cleaning our above ground pool with the #maytronics #dolphins50 #abovegroundpool #poolvacuum #poolrobot #dolohin  #notsponsored,maytronics;dolphins50;abovegroundpool;poolvacuum;poolrobot;dolohin;notsponsored,,Mission Impossible (Main Theme),Favorite Movie Songs,2021-07-06T23:41:43.000Z
7456202382028934443,https://www.tiktok.com/@terra.hills/video/7456202382028934443,terra.hills,https://www.tiktok.com/@terra.hills,1060,1.1K,8,8,,,,,Come clean my Dolphin Premier robotic pool cleaner with me #poolcleaning #dolphinpremier #asmr ,poolcleaning;dolphinpremier;asmr,,original sound,Terra Hills,2025-01-04T23:13:26.000Z
7252799178580020522,https://www.tiktok.com/@amymarietta/video/7252799178580020522,amymarietta,https://www.tiktok.com/@amymarietta,348400,348.4K,2881,2.9K,,,,,an Amazon find that will make your life so much easier 🤌🏼 @Smorobot  #amazonfinds #pooldesign #homeimprovement #smorobot  #poolhacks,amazonfinds;pooldesign;homeimprovement;smorobot;poolhacks,smorobot,Soft Jazz Background,Soft Jazz Trio,2023-07-06T20:05:08.000Z
7471104631662202158,https://www.tiktok.com/@poolcleaning_factory/video/7471104631662202158,poolcleaning_factory,https://www.tiktok.com/@poolcleaning_factory,952,952,12,12,,,,,Pool cleaning robot cleans your pool#VikingRise #tool #tiktok ,vikingrise;tool;tiktok,,Im your Christmas present baby demo,kafkaf ra nhạc mới,2025-02-14T03:01:49.000Z
7406535675694107934,https://www.tiktok.com/@whatsinside/video/7406535675694107934,whatsinside,https://www.tiktok.com/@whatsinside,115100,115.1K,3136,3.1K,,,,,Are Cordless Swimming Pool Cleaners worth it? Here’s my thoughts on @wybot_official S2 battery powered cleaner! What do you think? #swimmingpool #falling #robot ,swimmingpool;falling;robot,wybot.official,original sound,WHATS INSIDE,2024-08-24T03:01:23.000Z
7509225809475964206,https://www.tiktok.com/@meganmakesreviews/video/7509225809475964206,meganmakesreviews,https://www.tiktok.com/@meganmakesreviews,7363,7.4K,30,30,,,,,"Looking for a pool vacuum that actually lasts?! My dad’s had the @HaywardPoolProducts TracVac for a year—and it still climbs the walls, cleans shelves and corners, and picks up dirt like a pro. For in-ground pool owners, this one’s a game-changer. Best pool vacuum we’ve owned!  #poolvacuum #haywardpoolproducts #tracvac #ingroundpool #poolmaintenance #poolcleaning ",poolvacuum;haywardpoolproducts;tracvac;ingroundpool;poolmaintenance;poolcleaning,haywardpoolproducts,original sound,Megan Makes Reviews🗝️,2025-05-27T20:31:48.000Z
7503213671389154602,https://www.tiktok.com/@ashtonbrown007/video/7503213671389154602,ashtonbrown007,https://www.tiktok.com/@ashtonbrown007,14300,14.3K,77,77,,,,,Replying to @🌻  🌾  𝓔𝓶𝓲𝓵𝔂 🌾 🌻 AIPER Scuba SE Pool Robot Cleaner #PoolCleaner #SmartCleaning #PoolMaintenance #RobotVacuum #SparklingPool #CleanPooll#PoolHackss #AquaTech #Summer #SwimmingPoolCare  #PoolGadgets #Aiper,poolcleaner;smartcleaning;poolmaintenance;robotvacuum;sparklingpool;cleanpooll;poolhackss;aquatech;summer;swimmingpoolcare;poolgadgets;aiper,emmyjoann94,original sound,AshtonBrown007,2025-05-11T15:41:50.000Z
7492099585901399342,https://www.tiktok.com/@manifestwithjenni/video/7492099585901399342,manifestwithjenni,https://www.tiktok.com/@manifestwithjenni,60800,60.8K,211,211,,,,,"Pool season just got way easier. The Winny Pool Robotic Vacuum is doing all the hard work so you don’t have to — and it’s actually kinda fun to watch. 	•	Cordless + rechargeable = no tangles 	•	 scrubs the floor 	•	Smart sensors = no getting stuck 	•	Cleans your pool in just 90 minutes! If you’re tired of skimming, scrubbing, and dragging hoses — this little robot is about to be your poolside BFF. Just charge it, drop it in, and let it do its thing. #tiktokshop #tiktokshopcreatorpicks #tiktokshoprestock #tiktokshopmothersday #tiktokshopdealsfordays #blackfriday #fyp #viral #tiktokshopspringglowup #foryou #homerefresh SEO keywords: winny pool vacuum, robotic pool cleaner, pool cleaning robot, cordless pool vacuum, automatic pool vacuum, summer pool essential, tiktok viral pool gadget, clean pool hack, smart pool robot, pool maintenance made easy Search terms: best pool vacuum tiktok, robotic cleaner for pool, winny pool bot, easy pool cleaning tool, cordless pool cleaner, how to clean pool fast, smart vacuum for pool, summer pool care, automatic pool cleaning robot, viral pool cleaner 2025",tiktokshop;tiktokshopcreatorpicks;tiktokshoprestock;tiktokshopmothersday;tiktokshopdealsfordays;blackfriday;fyp;viral;tiktokshopspringglowup;foryou;homerefresh,,original sound,Manifest with Jenni,2025-04-11T16:53:32.000Z
7510033159766035758,https://www.tiktok.com/@rachelsreno/video/7510033159766035758,rachelsreno,https://www.tiktok.com/@rachelsreno,4300000,4.3M,85100,85.1K,,,,,This is a MUST HAVE purchase for your pool this summer! #poolvacuum #cleanpool #aiper #scubase #robotvaccuum #poolday #poolcleaning #pooltok #abovegroundpool #summer #poolday,poolvacuum;cleanpool;aiper;scubase;robotvaccuum;poolday;poolcleaning;pooltok;abovegroundpool;summer;poolday,,5 Minutes of Silence,Silenzio,2025-05-30T00:44:54.000Z
7580801622809333047,https://www.tiktok.com/@cashville_1975/video/7580801622809333047,cashville_1975,https://www.tiktok.com/@cashville_1975,344000,344.0K,533,533,,,,,#creatorsearchinsights #PoolCleaner #BackyardLiving #SummerPrep #tiktokshopcreatorpicks,creatorsearchinsights;poolcleaner;backyardliving;summerprep;tiktokshopcreatorpicks,,original sound,Cash King,2025-12-06T17:42:38.000Z
7343703407816969518,https://www.tiktok.com/@eddie4356/video/7343703407816969518,eddie4356,https://www.tiktok.com/@eddie4356,4100000,4.1M,18100,18.1K,,,,,On Sale Now! Plus Free Shipping! Robot Pool Vacuum #robot #pool #vacuum #robotvacuum #ofuzzi #cyber1200pro #onsale #freeshipping ,robot;pool;vacuum;robotvacuum;ofuzzi;cyber1200pro;onsale;freeshipping,,tropical reggae BGM no melody,yo suzuki(akisai),2024-03-07T19:20:50.000Z
7426110202056969518,https://www.tiktok.com/@poolologytx/video/7426110202056969518,poolologytx,https://www.tiktok.com/@poolologytx,11600,11.6K,70,70,,,,,"$1500 ROBOT Cleans Your Pool, Is it WORTH the big price tag? #RobotCleaner #BeatBot #PoolGuy #PoolMaintenance #PoolCleaner",robotcleaner;beatbot;poolguy;poolmaintenance;poolcleaner,,original sound,poolologytx,2024-10-15T21:00:24.000Z
