videoId,videoUrl,username,profileUrl,viewsCount,viewsDisplay,likesCount,likesDisplay,commentsCount,sharesCount,favoritesCount,caption,description,hashtags,mentions,musicTitle,musicAuthor,postedTime
7280711962835619118,https://www.tiktok.com/@bluh2opools/video/7280711962835619118,bluh2opools,https://www.tiktok.com/@bluh2opools,15500,15.5K,212,212,,,,,Pool-Cleaning Robots Explained,,,original sound,Blu H2O Pools,2023-09-20T01:20:59.000Z
7512644755755568430,https://www.tiktok.com/@gripandripped/video/7512644755755568430,gripandripped,https://www.tiktok.com/@gripandripped,77200,77.2K,132,132,,,,,Aiper robot pool vacuum review.  We will see how well it works I have a small pool. #walmart #Aiper #review ,walmart;aiper;review,,original sound,gripandripped,2025-06-06T01:39:10.000Z
7486182685061385474,https://www.tiktok.com/@me_llaman_geek/video/7486182685061385474,me_llaman_geek,https://www.tiktok.com/@me_llaman_geek,144100,144.1K,2904,2.9K,,,,,"Meto un robot limpia piscinas en la piscina MÁS SUCIA que he encontrado para ver si puede con toda la suciedad… El Scuba X1 de @aiperiberia es un robot limpia piscinas sin cables que promete limpiar suelos, paredes y la línea de flotación sin necesidad de intervención #AiperRobotPiscinas #aiper #aiperscubax1 #limpiapiscinas #limpiafondos #limpiafondospiscina #mejorlimpiapiscinas #poolvacuum ",aiperrobotpiscinas;aiper;aiperscubax1;limpiapiscinas;limpiafondos;limpiafondospiscina;mejorlimpiapiscinas;poolvacuum,,sonido original,Diego Rodríguez,2025-03-26T18:12:17.000Z
7524412532304416014,https://www.tiktok.com/@beasleysfamily/video/7524412532304416014,beasleysfamily,https://www.tiktok.com/@beasleysfamily,15200,15.2K,1769,1.8K,,,,,#fanttik #fanttikpoolcleaner #poolcleaning #poolcleaner #poolvacuum #poolrobot #robotvaccuum #robotpoolvacuum #pool #poolside #poolday #poolparty #poolside #poolmaintenance #poolupdate #poolupgrades #poolupgrade #abovegroundpool #poolservice #poolsetup #poolsidevibes #poolsoftiktok #poolseason #poolcare #cleanpool #poolcleaningservice #poolhack #tiktokshopcreatorpick #dealsforyoudays #dealsfordays #deals #summerset #summervibes #summeriscoming #summersale  #newtech #tech #cooltech #gadgets #newgadgets #coolstuff #smartpoolcleaner #smartpool #smarthome #smarthometechnology #bestgadgets #besttech #amazing #awesomefinds #greatfinds #musthaves #poolmusthaves ,fanttik;fanttikpoolcleaner;poolcleaning;poolcleaner;poolvacuum;poolrobot;robotvaccuum;robotpoolvacuum;pool;poolside;poolday;poolparty;poolside;poolmaintenance;poolupdate;poolupgrades;poolupgrade;abovegroundpool;poolservice;poolsetup;poolsidevibes;poolsoftiktok;poolseason;poolcare;cleanpool;poolcleaningservice;poolhack;tiktokshopcreatorpick;dealsforyoudays;dealsfordays;deals;summerset;summervibes;summeriscoming;summersale;newtech;tech;cooltech;gadgets;newgadgets;coolstuff;smartpoolcleaner;smartpool;smarthome;smarthometechnology;bestgadgets;besttech;amazing;awesomefinds;greatfinds;musthaves;poolmusthaves,,original sound,Beasley,2025-07-07T18:44:00.000Z
7575454507199450376,https://www.tiktok.com/@theaussiepoolguy/video/7575454507199450376,theaussiepoolguy,https://www.tiktok.com/@theaussiepoolguy,9496,9.5K,85,85,,,,,So I have released my first cordless robotic pool cleaner . Im nervous as I haven’t seen alot of these perform to make a judgement but from first impressions looks good. ZODIAC FREERIDER 2000IQ #poolguy #poolside #cleaners #theaussiepoolguy ,poolguy;poolside;cleaners;theaussiepoolguy,,original sound,theaussiepoolguy,2025-11-22T07:52:35.000Z
7492774531107425579,https://www.tiktok.com/@ourwintonhome/video/7492774531107425579,ourwintonhome,https://www.tiktok.com/@ourwintonhome,141000,141.0K,772,772,,,,,"Amazon pool find! This is a solar powered robot pool skimmer! This skimmer works AMAZING! We have had ours for over a year now, that’s why it’s slightly faded but I had to share with yall bc it’s the best thing ever if you have a pool! It’s solar powered, so it charges all day in the sun and runs non stop to keep your pools surface clean! We had a storm the day before I filmed this and you can see all of the dirt and leaves that it cleaned up out of the pool! It had it looking amazing the next day! I can’t say enough good things about this skimmer.❤️❤️ It will keep your pool clean and ready for swimming all summer long! #outdoorliving #poolideas #backyardvibes #amazonmusthaves #amazonoutdooor #summerfinds #poolfinds #summeressentials #pooltime #poolparty ",outdoorliving;poolideas;backyardvibes;amazonmusthaves;amazonoutdooor;summerfinds;poolfinds;summeressentials;pooltime;poolparty,,Sold out of Love,The Nude Party,2025-04-13T12:33:26.000Z
7368630053338467626,https://www.tiktok.com/@applesauceandadhd/video/7368630053338467626,applesauceandadhd,https://www.tiktok.com/@applesauceandadhd,1600000,1.6M,112800,112.8K,,,,,I was sent this to test out and I have thoughts… #poolvacuum #poolrobot #poolcleaning #poolside #poolopening #robotpoolvacuum #aiperpoolrobot ,poolvacuum;poolrobot;poolcleaning;poolside;poolopening;robotpoolvacuum;aiperpoolrobot,,original sound,Jess|Aggressive Tutorials,2024-05-13T23:28:12.000Z
7325968088233708846,https://www.tiktok.com/@betta_direct/video/7325968088233708846,betta_direct,https://www.tiktok.com/@betta_direct,6965,7.0K,30,30,,,,,Betta can capture the tiniest bugs and debris! 🩵 Betta Skimmer 🩵 A solar powered robotic skimmer that effectively cleans your pool! 💪🏻 #Betta #BettaSkimmer #BettaRobot #PoolRobot #poolcleaning #poolcleaningservice #roboticpoolcleaner  #poolmaintenance #PoolCleaner,betta;bettaskimmer;bettarobot;poolrobot;poolcleaning;poolcleaningservice;roboticpoolcleaner;poolmaintenance;poolcleaner,,original sound - Bettabot,betta_direct,2024-01-20T00:18:14.000Z